{
  "version": "vate-0.3",
  "profile": "VATE-AL2-Verifier-Admission-v0.3",
  "receipt_type": "admission",
  "receipt_id": "admrec-20260701-jose-crit-unsupported-001",
  "issued_at": "2026-07-01T00:17:08Z",
  "expires_at": "2026-07-01T00:27:08Z",
  "verifier": {
    "id": "did:web:verifier.example"
  },
  "request": {
    "request_id": "areq-20260701-jose-crit-unsupported-001",
    "transaction_id": "txn-20260701-jose-crit-unsupported-001",
    "action": "crm.case.update",
    "input_hash": "sha-256:b5eaf9a27d486a4e2a390eb15f1746e4e1b4b448f87d777bd9e3ed8a03e6bacd"
  },
  "subject": {
    "principal": "did:web:user.example",
    "actor": "did:web:agent.example",
    "runtime": "spiffe://agent.example/workload/case-agent"
  },
  "evidence": [
    {
      "type": "runtime_attestation",
      "uri": "https://agent.example/attestations/runtime/jose-crit-unsupported-001",
      "digest": {
        "alg": "sha-256",
        "value": "6dd0e22614bc851ca7a55eee7fd9320f048c1f59d53b23c7c2d9fb1b956e5e73"
      },
      "verification": {
        "result": "failed",
        "checked_at": "2026-07-01T00:17:05Z",
        "method": "detached-jws-fixture",
        "failure_reason": "The protected JOSE header included unsupported critical parameters."
      }
    }
  ],
  "policy": {
    "policy_id": "al2-crm-case-update",
    "policy_version": "2026-07-01.1",
    "policy_ref": "https://verifier.example/policies/al2-crm-case-update/2026-07-01.1"
  },
  "decision": {
    "outcome": "deny",
    "reason_codes": [
      "SCHEMA_INVALID",
      "FAIL_CLOSED"
    ]
  }
}
