{
  "version": "vate-0.3",
  "profile": "VATE-AL2-Verifier-Admission-v0.3",
  "receipt_type": "admission",
  "receipt_id": "admrec-20260701-alg-not-allowed-001",
  "issued_at": "2026-07-01T00:10:08Z",
  "expires_at": "2026-07-01T00:20:08Z",
  "verifier": {
    "id": "did:web:verifier.example"
  },
  "request": {
    "request_id": "areq-20260701-alg-not-allowed-001",
    "transaction_id": "txn-20260701-alg-not-allowed-001",
    "action": "storage.object.publish",
    "input_hash": "sha-256:5cd35fec2a37c4cdf941796005e30ce7faeaeaf696943ab83da0e46032d91d50"
  },
  "subject": {
    "principal": "did:web:user.example",
    "actor": "did:web:agent.example",
    "runtime": "spiffe://agent.example/workload/publish-agent"
  },
  "evidence": [
    {
      "type": "runtime_attestation",
      "uri": "https://agent.example/attestations/runtime/alg-not-allowed-001",
      "digest": {
        "alg": "sha-256",
        "value": "35e4d9343f52bf54357aa0b187cd598fa301d15300769a5753cfd5a1759008e2"
      },
      "verification": {
        "result": "failed",
        "checked_at": "2026-07-01T00:10:05Z",
        "method": "trust-bundle-lookup",
        "failure_reason": "Presented proof algorithm was not allowed for the matched trust anchor."
      }
    }
  ],
  "policy": {
    "policy_id": "al2-storage-publish",
    "policy_version": "2026-07-01.1",
    "policy_ref": "https://verifier.example/policies/al2-storage-publish/2026-07-01.1"
  },
  "decision": {
    "outcome": "deny",
    "reason_codes": [
      "ALG_NOT_ALLOWED",
      "FAIL_CLOSED"
    ]
  }
}
