{
  "version": "vate-0.3",
  "profile": "VATE-AL2-Verifier-Admission-v0.3",
  "receipt_type": "admission",
  "receipt_id": "admrec-20260519-token-authority-bound-001",
  "issued_at": "2026-05-19T10:00:08Z",
  "expires_at": "2026-05-19T10:05:00Z",
  "verifier": {
    "id": "did:web:verifier.example",
    "key_id": "did:web:verifier.example#key-1"
  },
  "request": {
    "request_id": "areq-20260519-token-authority-bound-001",
    "transaction_id": "txn-20260519-token-authority-bound-001",
    "action": "crm.case.update",
    "input_hash": "sha-256:c2c4a0a50041314f9b01b58425c446d7a32016fee32a4a7dfa8eb1b95598d2a3",
    "audience": "https://mcp.crm.example",
    "target_audience": "https://mcp.crm.example",
    "target_resource": "mcp://crm.example/tools/cases.update",
    "transport": {
      "protocol": "mcp",
      "oauth": {
        "issuer": "https://auth.example",
        "audience": "https://mcp.crm.example",
        "resource": "mcp://crm.example/tools/cases.update",
        "protected_resource": "mcp://crm.example/tools/cases.update",
        "token_present": true,
        "token_kind": "bearer",
        "upstream_authorization": "matched",
        "resource_binding": "matched",
        "required_scope": "crm.case.update",
        "scopes": [
          "crm.case.update"
        ],
        "proof_of_possession": "dpop-jkt:base64url-thumbprint"
      },
      "openid": {
        "issuer": "https://auth.example",
        "subject": "did:web:user.example",
        "client_id": "did:web:agent.example"
      },
      "mcp": {
        "authorized_tool": "cases.update",
        "authorized_tool_class": "write",
        "requested_tool": "cases.update",
        "requested_tool_class": "write"
      }
    }
  },
  "subject": {
    "principal": "did:web:user.example",
    "actor": "did:web:agent.example",
    "runtime": "spiffe://agent.example/workload/case-agent"
  },
  "evidence": [
    {
      "type": "oauth_access_token",
      "protocol_hint": "mcp-oauth",
      "uri": "https://auth.example/token-introspection/tok-20260519-token-authority-bound-001",
      "digest": {
        "alg": "sha-256",
        "value": "fa9e793bcb8cd9b1d439cac334170a5c1f7ee3784cc7d304ff9010047fcb0d9f"
      },
      "verification": {
        "result": "verified",
        "checked_at": "2026-05-19T10:00:01Z",
        "method": "oauth-authority-binding-check",
        "status_result": "active"
      }
    },
    {
      "type": "openid_subject",
      "protocol_hint": "openid-connect",
      "uri": "https://auth.example/openid/session/sub-20260519-token-authority-bound-001",
      "digest": {
        "alg": "sha-256",
        "value": "5522a0918afbded1eb7bfd88bae894f28427725b12fc583bafb80fb555ef3d79"
      },
      "verification": {
        "result": "verified",
        "checked_at": "2026-05-19T10:00:02Z",
        "method": "openid-claims-binding",
        "status_result": "active"
      }
    },
    {
      "type": "runtime_attestation",
      "protocol_hint": "spiffe",
      "uri": "https://agent.example/attestations/runtime/rp-20260519-token-authority-bound-001",
      "digest": {
        "alg": "sha-256",
        "value": "1679d86298cbd4b9a27c68c4fe0cb6a5b41ba600d0d6f571082c571502c9d49b"
      },
      "verification": {
        "result": "verified",
        "checked_at": "2026-05-19T10:00:03Z",
        "method": "workload-attestation",
        "status_result": "active"
      }
    }
  ],
  "policy": {
    "policy_id": "al2-mcp-crm-case-update",
    "policy_version": "2026-05-19.1",
    "policy_ref": "https://verifier.example/policies/al2-mcp-crm-case-update/2026-05-19.1"
  },
  "decision": {
    "outcome": "allow",
    "reason_codes": [
      "EVIDENCE_VERIFIED",
      "POLICY_MATCH"
    ],
    "human_readable_summary": "The request is allowed because token presence is paired with matching upstream authority, resource binding, actor, runtime, and local policy."
  },
  "proof": {
    "format": "detached_jws",
    "alg": "ES256",
    "kid": "did:web:verifier.example#key-1",
    "signature_ref": "https://verifier.example/vate/signatures/admrec-20260519-token-authority-bound-001.jws"
  }
}
