{
  "version": "vate-0.3",
  "profile": "VATE-AL2-Verifier-Admission-v0.3",
  "receipt_type": "admission",
  "receipt_id": "admrec-20260701-policy-snapshot-mismatch-001",
  "issued_at": "2026-07-01T00:01:08Z",
  "expires_at": "2026-07-01T00:11:08Z",
  "verifier": {
    "id": "did:web:verifier.example"
  },
  "request": {
    "request_id": "areq-20260701-policy-snapshot-mismatch-001",
    "transaction_id": "txn-20260701-policy-snapshot-mismatch-001",
    "action": "repo.pull_request.merge",
    "input_hash": "sha-256:e32766186255d22e15d60e549f719b925c0416a2836712b773a3f4ea7d2d17dc"
  },
  "subject": {
    "principal": "did:web:user.example",
    "actor": "did:web:agent.example",
    "runtime": "spiffe://agent.example/workload/repo-agent"
  },
  "evidence": [
    {
      "type": "policy_snapshot",
      "uri": "https://verifier.example/policies/al2-repo-merge/snapshots/2026-07-01.1",
      "digest": {
        "alg": "sha-256",
        "value": "0000000000000000000000000000000000000000000000000000000000000000"
      },
      "verification": {
        "result": "failed",
        "checked_at": "2026-07-01T00:01:05Z",
        "method": "policy-snapshot-digest-check",
        "failure_reason": "Referenced policy snapshot digest did not match the artifact used as the decision basis."
      }
    }
  ],
  "policy": {
    "policy_id": "al2-repo-merge",
    "policy_version": "2026-07-01.1",
    "policy_ref": "https://verifier.example/policies/al2-repo-merge/2026-07-01.1",
    "policy_snapshot": {
      "uri": "https://verifier.example/policies/al2-repo-merge/snapshots/2026-07-01.1",
      "media_type": "application/vate-policy-snapshot+json",
      "digest": {
        "alg": "sha-256",
        "value": "0000000000000000000000000000000000000000000000000000000000000000"
      }
    }
  },
  "decision": {
    "outcome": "deny",
    "reason_codes": [
      "POLICY_SNAPSHOT_MISMATCH",
      "FAIL_CLOSED"
    ]
  }
}
