{
  "version": "vate-0.3",
  "profile": "VATE-AL2-Verifier-Admission-v0.3",
  "receipt_type": "admission",
  "receipt_id": "admrec-20260701-jose-es384-not-allowed-001",
  "issued_at": "2026-07-01T00:18:08Z",
  "expires_at": "2026-07-01T00:28:08Z",
  "verifier": {
    "id": "did:web:verifier.example"
  },
  "request": {
    "request_id": "areq-20260701-jose-es384-not-allowed-001",
    "transaction_id": "txn-20260701-jose-es384-not-allowed-001",
    "action": "crm.case.update",
    "input_hash": "sha-256:177664f249873f18ceebb25d375cdb6254b459ec5ec0811f3859949974e7158b"
  },
  "subject": {
    "principal": "did:web:user.example",
    "actor": "did:web:agent.example",
    "runtime": "spiffe://agent.example/workload/case-agent"
  },
  "evidence": [
    {
      "type": "runtime_attestation",
      "uri": "https://agent.example/attestations/runtime/jose-es384-not-allowed-001",
      "digest": {
        "alg": "sha-256",
        "value": "813a4c16f11ac4eb05959a32655ec10ddbb617cc2270bc39274852fa6e417d3a"
      },
      "verification": {
        "result": "failed",
        "checked_at": "2026-07-01T00:18:05Z",
        "method": "jose-algorithm-policy",
        "failure_reason": "The protected JOSE header attempted to use ES384 for a trust anchor that only allows ES256 runtime evidence."
      }
    }
  ],
  "policy": {
    "policy_id": "al2-crm-case-update",
    "policy_version": "2026-07-01.1",
    "policy_ref": "https://verifier.example/policies/al2-crm-case-update/2026-07-01.1"
  },
  "decision": {
    "outcome": "deny",
    "reason_codes": [
      "ALG_NOT_ALLOWED",
      "FAIL_CLOSED"
    ],
    "human_readable_summary": "The request is denied because the JOSE proof used an asymmetric algorithm that is not allowed by the matched trust anchor."
  }
}
