{"decision":{"outcome":"allow","reason_codes":["EVIDENCE_VERIFIED","POLICY_MATCH"]},"evidence":[{"digest":{"alg":"sha-256","value":"e0ecec343b3afe15b9d99061d76d883a7435e4d0a49c109daf2c7c1301266842"},"type":"mission_permit","uri":"local:admission-1/permit.json","verification":{"checked_at":"2026-09-15T06:25:06Z","method":"demo-local-permit-binding-and-vate-core","result":"verified"}}],"expires_at":"2026-09-15T06:35:06Z","issued_at":"2026-09-15T06:25:06Z","policy":{"policy_id":"demo-file-set","policy_ref":"local:policy.json","policy_version":"1"},"profile":"VATE-AL2-Verifier-Admission-v0.3","proof":{"format":"none"},"receipt_id":"admrec-request-auth-96cb5f19df834c10891f487559f8802b","receipt_type":"admission","request":{"action":"demo.create_file_set","action_binding":{"canonicalization":"vate-v0.3-fixture-json;ascii-escaped;sorted;compact;no-floats","digest":{"alg":"sha-256","value":"2dd82b6d153cbc317f3d7bfde92f7833b93a2fb6d239666b0709b2bc8b08e5f6"},"preimage_profile":"vate-demo-file-set-v1","type":"profile_defined_digest"},"constraints":{"demo_output_names":["summary.txt"],"expected_runtime":"urn:vate:demo:file-provider","status":{"state":"active"},"target_resource":"urn:vate:demo:sandbox:f407916961f84035b8f81ca82740fd3f","tool_allowlist":["demo.create_file_set"]},"input_hash":"sha-256:2dd82b6d153cbc317f3d7bfde92f7833b93a2fb6d239666b0709b2bc8b08e5f6","request_id":"request-auth-96cb5f19df834c10891f487559f8802b","transaction_id":"op-f407916961f84035b8f81ca82740fd3f"},"subject":{"actor":"urn:vate:demo:requester","principal":"urn:vate:demo:local-owner","runtime":"urn:vate:demo:file-provider"},"verifier":{"id":"urn:vate:demo:admission-verifier"},"version":"vate-0.3"}