{
  "version": "vate-0.3",
  "profile": "VATE-AL2-Verifier-Admission-v0.3",
  "receipt_type": "admission",
  "receipt_id": "admrec-oap-interop-20260701-001",
  "issued_at": "2026-07-01T00:20:08Z",
  "expires_at": "2026-07-01T00:25:00Z",
  "verifier": {
    "id": "did:web:verifier.example"
  },
  "request": {
    "request_id": "areq-oap-interop-20260701-001",
    "transaction_id": "txn-oap-interop-20260701-001",
    "action": "crm.case.update",
    "input_hash": "sha-256:81586f3ab4391e6d0aa924bd5e41f6e9daff33f6c9cfd0c675279c25ae9f8437"
  },
  "subject": {
    "principal": "did:web:user.example",
    "actor": "did:web:agent.example",
    "runtime": "spiffe://agent.example/workload/case-agent"
  },
  "evidence": [
    {
      "type": "oap_decision",
      "protocol_hint": "oap_aport",
      "uri": "examples/interop/oap-to-vate/oap-decision.example.json",
      "digest": {
        "alg": "sha-256",
        "value": "55c82155841b1995d47db98187413be0e315198f388a34abe97d0df9a641952d"
      },
      "verification": {
        "result": "verified",
        "checked_at": "2026-07-01T00:20:06Z",
        "method": "adjacent-decision-verification",
        "status_result": "active"
      }
    }
  ],
  "policy": {
    "policy_id": "al2-crm-case-update",
    "policy_version": "2026-07-01.1",
    "policy_ref": "https://verifier.example/policies/al2-crm-case-update/2026-07-01.1"
  },
  "decision": {
    "outcome": "allow",
    "reason_codes": [
      "EVIDENCE_VERIFIED",
      "POLICY_MATCH"
    ],
    "human_readable_summary": "The verifier accepted the OAP-style decision object as adjacent evidence and admitted the CRM update under local AL2 policy."
  }
}
