{
  "version": "vate-0.3",
  "profile": "VATE-AL2-Verifier-Admission-v0.3",
  "receipt_type": "admission",
  "receipt_id": "admrec-20260519-tool-class-001",
  "issued_at": "2026-05-19T10:20:08Z",
  "expires_at": "2026-05-19T10:25:00Z",
  "verifier": {
    "id": "did:web:verifier.example",
    "key_id": "did:web:verifier.example#key-1"
  },
  "request": {
    "request_id": "areq-20260519-tool-class-001",
    "transaction_id": "txn-20260519-tool-class-001",
    "action": "crm.case.update",
    "input_hash": "sha-256:0ae4bf236da87ccda029fb4ded1745b02a6d55eb305c3d81ae51cc5f581a028a",
    "audience": "https://mcp.crm.example",
    "target_audience": "https://mcp.crm.example",
    "target_resource": "mcp://crm.example/tools/cases.update",
    "transport": {
      "protocol": "mcp",
      "oauth": {
        "issuer": "https://auth.example",
        "audience": "https://mcp.crm.example",
        "resource": "mcp://crm.example/tools/cases.update",
        "required_scope": "crm.case.update",
        "scopes": [
          "crm.case.update"
        ],
        "proof_of_possession": "dpop-jkt:base64url-thumbprint"
      },
      "openid": {
        "issuer": "https://auth.example",
        "subject": "did:web:user.example",
        "client_id": "did:web:agent.example"
      },
      "mcp": {
        "authorized_tool": "cases.search",
        "authorized_tool_class": "read",
        "requested_tool": "cases.update",
        "requested_tool_class": "write"
      }
    }
  },
  "subject": {
    "principal": "did:web:user.example",
    "actor": "did:web:agent.example",
    "runtime": "spiffe://agent.example/workload/case-agent"
  },
  "evidence": [
    {
      "type": "oauth_access_token",
      "protocol_hint": "mcp-oauth",
      "uri": "https://auth.example/token-introspection/tok-20260519-tool-class-001",
      "digest": {
        "alg": "sha-256",
        "value": "fb4da02fb1085b3b6538d0374483bae66f360ce9a3f1538b12dc4f058e6ec19e"
      },
      "verification": {
        "result": "failed",
        "checked_at": "2026-05-19T10:20:01Z",
        "method": "mcp-tool-class-boundary-check",
        "status_result": "tool_class_mismatch",
        "failure_reason": "The MCP/OAuth evidence authorizes read/search tool use, but the requested action is write/side-effecting on the same provider.",
        "diagnostic_code": "mcp_tool_class_mismatch",
        "redaction": {
          "token_material": "omitted",
          "tool_payload": "omitted",
          "resource_description": "omitted"
        }
      }
    },
    {
      "type": "openid_subject",
      "protocol_hint": "openid-connect",
      "uri": "https://auth.example/openid/session/sub-20260519-tool-class-001",
      "digest": {
        "alg": "sha-256",
        "value": "da934d069dce3ead7c47da1b32abe728eb06892a38521751e8c4f745c3a7f1a3"
      },
      "verification": {
        "result": "verified",
        "checked_at": "2026-05-19T10:20:02Z",
        "method": "openid-claims-binding",
        "status_result": "active"
      }
    },
    {
      "type": "runtime_attestation",
      "protocol_hint": "spiffe",
      "uri": "https://agent.example/attestations/runtime/rp-20260519-tool-class-001",
      "digest": {
        "alg": "sha-256",
        "value": "fb1248fea0ed43e64967fe8f68bff08922f7dffea349cb9abc168b13c6dfd097"
      },
      "verification": {
        "result": "verified",
        "checked_at": "2026-05-19T10:20:03Z",
        "method": "workload-attestation",
        "status_result": "active"
      }
    }
  ],
  "policy": {
    "policy_id": "al2-mcp-crm-case-update",
    "policy_version": "2026-05-19.1",
    "policy_ref": "https://verifier.example/policies/al2-mcp-crm-case-update/2026-05-19.1"
  },
  "decision": {
    "outcome": "deny",
    "reason_codes": [
      "TOOL_CLASS_MISMATCH",
      "FAIL_CLOSED"
    ],
    "human_readable_summary": "The request is denied because provider and resource similarity is not enough to convert read/search MCP authority into write/execute authority."
  },
  "proof": {
    "format": "detached_jws",
    "alg": "ES256",
    "kid": "did:web:verifier.example#key-1",
    "signature_ref": "https://verifier.example/vate/signatures/admrec-20260519-tool-class-001.jws"
  }
}
