{
  "version": "vate-0.3",
  "profile": "VATE-AL2-Verifier-Admission-v0.3",
  "receipt_type": "admission",
  "receipt_id": "admrec-20260504-allow-001",
  "issued_at": "2026-05-04T03:00:08Z",
  "expires_at": "2026-05-04T03:10:08Z",
  "verifier": {
    "id": "did:web:verifier.example",
    "key_id": "did:web:verifier.example#key-1"
  },
  "request": {
    "request_id": "areq-20260504-allow-001",
    "transaction_id": "txn-20260504-allow-001",
    "a2a_context_id": "ctx-allow-001",
    "a2a_task_id": "task-allow-001",
    "action": "crm.case.update",
    "input_hash": "sha-256:1830d13118c98983bb2d942aa358715059d2ac3301a6b7296f0832a126a5c186"
  },
  "subject": {
    "principal": "did:web:user.example",
    "actor": "did:web:agent.example",
    "runtime": "spiffe://agent.example/workload/case-agent"
  },
  "evidence": [
    {
      "type": "agent_card",
      "uri": "https://agent.example/.well-known/agent-card.json",
      "digest": {
        "alg": "sha-256",
        "value": "7f718ba23da075884d5be74fe69b983f6d6ffc192c00983ebedc3f94abe041da"
      },
      "verification": {
        "result": "verified",
        "checked_at": "2026-05-04T03:00:01Z",
        "method": "signed-agent-card",
        "status_result": "active"
      }
    },
    {
      "type": "runtime_attestation",
      "uri": "https://agent.example/attestations/runtime/rp-allow-001",
      "digest": {
        "alg": "sha-256",
        "value": "6dd0e22614bc851ca7a55eee7fd9320f048c1f59d53b23c7c2d9fb1b956e5e73"
      },
      "verification": {
        "result": "verified",
        "checked_at": "2026-05-04T03:00:02Z",
        "method": "workload-attestation",
        "status_result": "active"
      }
    }
  ],
  "policy": {
    "policy_id": "al2-crm-case-update",
    "policy_version": "2026-05-04.1",
    "policy_ref": "https://verifier.example/policies/al2-crm-case-update/2026-05-04.1"
  },
  "decision": {
    "outcome": "allow",
    "reason_codes": [
      "EVIDENCE_VERIFIED",
      "POLICY_MATCH"
    ],
    "human_readable_summary": "The request is allowed because identity, runtime, audience, and local policy checks passed."
  },
  "proof": {
    "format": "detached_jws",
    "alg": "ES256",
    "kid": "did:web:verifier.example#key-1",
    "signature_ref": "https://verifier.example/vate/signatures/admrec-20260504-allow-001.jws"
  }
}

